{
  "$schema": "../../src/data/schema/protocol.schema.json",
  "id": "demo-protocol",
  "title": "Демонстрационный протокол (образец структуры)",
  "version": "0.1.0-demo",
  "sourceDocument": "Демонстрационный документ (не является медицинским источником)",
  "sourceDate": "2026-01-01",
  "lastReviewed": "2026-07-21",
  "sections": [
    {
      "id": "obshchie-svedeniya",
      "title": "Раздел 1. Общие сведения",
      "kind": "default",
      "blocks": [
        {
          "type": "text",
          "body": "Текст абзаца 1. Это демонстрационная заглушка, а не медицинская информация.\n\nТекст абзаца 2. Здесь показано, как абзацы разделяются пустой строкой."
        },
        {
          "type": "warning",
          "body": "Текст предупреждения. Демонстрационная заглушка."
        }
      ]
    },
    {
      "id": "pokazaniya",
      "title": "Раздел 2. Показания (пример)",
      "kind": "inclusion",
      "blocks": [
        {
          "type": "text",
          "body": "Текст вводного абзаца раздела. Демонстрационная заглушка."
        },
        {
          "type": "criteria-list",
          "kind": "inclusion",
          "items": ["Критерий 1", "Критерий 2", "Критерий 3"]
        }
      ]
    },
    {
      "id": "protivopokazaniya-absolyutnye",
      "title": "Раздел 3. Абсолютные противопоказания (пример)",
      "kind": "exclusion-absolute",
      "blocks": [
        {
          "type": "criteria-list",
          "kind": "exclusion-absolute",
          "items": ["Критерий A", "Критерий B"]
        },
        {
          "type": "warning",
          "body": "Текст предупреждения раздела. Демонстрационная заглушка."
        }
      ]
    },
    {
      "id": "protivopokazaniya-otnositelnye",
      "title": "Раздел 4. Относительные противопоказания (пример)",
      "kind": "exclusion-relative",
      "blocks": [
        {
          "type": "criteria-list",
          "kind": "exclusion-relative",
          "items": ["Критерий X", "Критерий Y", "Критерий Z"]
        },
        {
          "type": "text",
          "body": "Текст примечания к разделу. Демонстрационная заглушка."
        }
      ]
    },
    {
      "id": "dozirovki",
      "title": "Раздел 5. Таблица (пример)",
      "kind": "default",
      "blocks": [
        {
          "type": "dosage-table",
          "title": "Заголовок таблицы (пример)",
          "columns": ["Колонка 1", "Колонка 2", "Колонка 3"],
          "rows": [
            ["Строка 1", "Пример дозировки", "Текст примечания"],
            ["Строка 2", "Пример дозировки", "Текст примечания"],
            ["Строка 3", "Пример дозировки", "Текст примечания"]
          ]
        },
        {
          "type": "timer-note",
          "label": "Метка окна",
          "body": "Текст примечания о временном окне. Демонстрационная заглушка, отсчёта времени нет."
        }
      ]
    },
    {
      "id": "chek-list",
      "title": "Раздел 6. Чек-лист (пример)",
      "kind": "default",
      "blocks": [
        {
          "type": "checklist",
          "items": ["Пункт 1", "Пункт 2", "Пункт 3", "Пункт 4"]
        },
        {
          "type": "timer-note",
          "body": "Текст примечания без метки. Демонстрационная заглушка."
        },
        {
          "type": "text",
          "body": "Текст заключительного абзаца. Демонстрационная заглушка."
        }
      ]
    }
  ]
}
